متن سوال,گزینه ۱,گزینه ۲,گزینه ۳,گزینه ۴,گزینه صحیح,لینک تصویر
رانندگان کلیه وسایل نقلیه موظفند از کدام خط عبور راه حرکت نمایند؟,خط وسط,سمت راست,سمت چپ,خط زیگزاگ,سمت راست,
این تابلو بیانگر چیست؟,تراکم ترافیک,جهت عبور در میدان,پیچ به چپ,میدان,جهت عبور در میدان,blob:https://web.telegram.org/53369900-0dfe-420b-b6b7-9f51d9744401
به هنگام ترکیدن لاستیک کدام مورد را باید انجام داد؟,دنده را تعویض کرده و سس ترمز کنید.,فرمان را به شدت و محکم بگیرید و اجازه دهید اتومبیل خود به خود متوقف شود.,ترمز کرده و سریع متوقف کنید.,فرمان را شل بگیرید و محکم ترمز کنید.,فرمان را به شدت و محکم بگیرید و اجازه دهید اتومبیل خود به خود متوقف شود.,
اسم این تابلو چیست؟,ورود ممنوع,توقف ممنوع,ورود از هر دو طرف ممنوع,راه مسدود است.,ورود ممنوع,blob:https://web.telegram.org/4a6453a7-9cda-4a02-aee8-ba6d242d9901
در باتری های آبی میزان آب باتری چه موقع مورد بررسی قرار می گیرد؟,هر ۵ هزار کیلومتر,هر ۲۰ هزار کیلومتر,هر ۱۵ هزار کیلومتر,هر ۵ هزار کیلومتر,هر ۵ هزار کیلومتر,
(دیر رسیدن بهتر از هرگز نرسیدن است) جمله چه مفهومی را می رساند؟,پرهیز از عجله و شتاب در رانندگی,با سرعت بالا حرکت کردن از صحنه حادثه,عدم توجه به قوانین و مقررات, رعایت کردن قوانین مربوط به پارک,پرهیز از عجله و شتاب در رانندگی,
بازگذاشتن در صندوق عقب وسایل نقلیه در حال حرکت …,مجاز است,در صورت داشتن بار مجاز است,در صورت رعایت سایر شرایط مجاز است,ممنوع است.,ممنوع است.,blob:https://web.telegram.org/02f82c62-5a4c-4104-8861-6b74f715a10b
تابلو زیر به چه معناست ؟,فقط عبور مستقیم مجاز,راه یک طرفه,خیابان یک طرفه,فقط عبور به راست مجاز,خیابان یک طرفه,blob:https://web.telegram.org/95a01829-fb03-4080-aa77-18dccdbe967a
کدام گزینه در مورد ضدیخ صحیح نمی باشد؟,مایع ضد یخ از یخ زدگی آب در سرما جلوگیری می کند,عدم استفاده از ضدیخ در تابستان می تواند منجر به جوش آوردن زودتر موتور شود.,ضدیخ در جلوگیری از زنگ زدگی رادیاتور و قطعات سیستم خنک کاری موثر است., بهتر است کل مخزن رادیاتور به جای آب از ضد یخ پر شود, بهتر است کل مخزن رادیاتور به جای آب از ضد یخ پر شود,
 نام این تابلو چیست؟,گذرگاه عابر پیاده,عبور پیاده ممنوع,عبور اطفال,عبور عابر پیاده,گذرگاه عابر پیاده,blob:https://web.telegram.org/fcdf01df-ba33-4736-9743-cc4425dc9647
کدامیک از پاسخ های زیر در خصوص نقص در سیستم جلوبندی و یا شکستگی آن صحیح می باشد؟, تایر های عقب خودرو ساییده میشود.,مصرف سوخت افزایش میابد.,هدایت و کنترل خودرو از دست راننده خارج میشود.,رادیاتور خودرو جوش می آورد.,هدایت و کنترل خودرو از دست راننده خارج میشود.,
 این تابلو بیانگر چیست؟,جهت عبور در میدان,عبور از سمت راست مجاز,عبور به چپ مجاز,عبور از هر دو سمت مجاز,عبور از هر دو سمت مجاز,blob:https://web.telegram.org/57fd0252-fe05-4c59-ba2b-9b56cffa7b15
کدامیک از موارد زیر در خصوص عبور از روی خط آهن صحیح می باشد؟,در حین عبور از خط آهن بایستی دنده خودرو را از دنده سبک به دنده سنگین تغییر داد.,قبل از رسیدن به خط آهن باید سرعت را افزایش داده و با سرعت از خط آهن عبور نمود.,در حین عبور از خط آهن دنده خودرو را از دنده سنگین به دنده سبک تغییر داد.,در حین عبور از خط آهن بایستی از تعویض دنده خودداری نمود.,در حین عبور از خط آهن بایستی از تعویض دنده خودداری نمود.,
این تابلو بیان گر چیست؟,فقط عبور پیاده,عبور عابر پیاده و همراه,عابر پیاده,گذرگاه پیاده,فقط عبور پیاده,blob:https://web.telegram.org/d737d52f-0ef0-475a-94e7-48b9983859f4
تابلوی توقف ممنوع کدام گزینه می باشد؟,1,2,3,4,2,blob:https://web.telegram.org/26774e05-ad62-4317-a850-3c5243d3843a
کدامیک از موارد زیر جز سیستم اگزوز خودرو میباشد؟,کاتالیست,فن,نشانگر سوخت,فیلتر هوا,کاتالیست,
تابلو های هشدار دهنده یا … بیشتر به صورت … با نوار حاشیه … رنگ و زمینه … رنگ می باشد.,اخطاری - مثلث - قرمز – سفید,اخطاری - مربع - قرمز - سفید,اخباری - دایره - قرمز – آبی,انتظامی - پنج ضلعی - قرمز – سفید,اخطاری - مثلث - قرمز – سفید,
استفاده از حداقل سرعت مجاز برای کلیه وسایل نقلیه صرفا در …,خط عبوری سمت چپ راست جانب شانه آزادراه مجاز می باشد.,خط عبوری سمت راست جانب شانه آزادراه مجاز می باشد.,تمامی خط عبور مجاز می باشد., بستگی به نوع وسیله نقلیه دارد.,خط عبوری سمت راست جانب شانه آزادراه مجاز می باشد.,
"کدام تابلو، تقاطع راه آهن بدون راهبند را اعلام می دارد؟",1,2,3,4,2,blob:https://web.telegram.org/c4793fbc-3ae0-4f8c-9a91-96b0b034785a
عنوان این تابلو چیست؟,عبور گاری ممنوع,عبور کامیون ممنوع,عبور کامیون یدک دار ممنوع,عبور خودرو با یدک ممنوع,عبور خودرو با یدک ممنوع,blob:https://web.telegram.org/a1e2e2df-68e0-4427-9881-00bbc75bece7
عنوان این تابلو چیست؟,عبور وسایل نقلیه موتوری ممنوع,عبور وسایل نقلیه ممنوع,عبور سواری ممنوع,عبور سواری شخصی ممنوع,عبور سواری ممنوع,blob:https://web.telegram.org/cf5fde48-5321-4bf2-bd25-ff99fbf8b41e
تابلوی پایین یعنی … ؟,رعایت حق تقدم,ورود ممنوع,توقف ممنوع,ایست,ایست,blob:https://web.telegram.org/25ba0600-23fd-4c0e-848a-be48aa5a5b65
تابلوی عبور وسایل نقلیه موتوری ممنوع کدام گزینه می باشد؟,1,2,3,4,2,blob:https://web.telegram.org/18d95c7f-3df2-4fea-86a4-b8dfd7381608
استفاده از بوق در کدامیک از موارد زیر مجاز است؟,اطلاع و آگاه سازی سایر کاربران راه و جلوگیری از بروزسانحه و خطر,اطلاع و آگاه سازی برای ادای احترام به سایر کاربران راه,برای کاهش شدت تصادفات,برای کاهش شدت تصادفات و آگاهی سایر کاربران راه,اطلاع و آگاه سازی سایر کاربران راه و جلوگیری از بروزسانحه و خطر,
نام این تابلو چیست؟,شانه خطرناک,برآمدگی,پل متحرک,راه لغزنده,شانه خطرناک,blob:https://web.telegram.org/348f206f-60d1-4ba2-807b-9076efafb3a1
در چه فاصله ای از تقاطع و میادین توقف وسایل نقلیه ممنوع است؟,15 متری,20 متری,30 متری,۵ متری,15 متری,
این تابلو بیانگر چیست؟,فقط عبور پیاده,فقط عبور دوچرخه و پیاده,گذرگاه پیاده,عبور اطفال,گذرگاه پیاده,blob:https://web.telegram.org/e27f03dd-a68e-4384-a26b-21091708d383
در کدامیک از محل های زیر ایستادن یا توقف مجاز است؟,در فاصله 10 متری تقاطع,خطوط پارک,روی پل ها,پیاده رو گذرگاه پیاده,خطوط پارک,
 نام این تابلو چیست؟,عبور حیوانات اهلی,پایان منطقه مسکونی,عبور حیوانات وحشی,فقط عبور آهو,عبور حیوانات وحشی,blob:https://web.telegram.org/f92b2fa8-9471-431d-8811-b05882a3f20e
این تابلو بیانگر چیست؟,عبور دوچرخه ممنوع,بوق زدن ممنوع,فقط عبور دوچرخه و پیاده,مدرسه,عبور دوچرخه ممنوع,blob:https://web.telegram.org/4660611a-faf1-46a7-b836-6a1a7fbc1427
